year,round,authority,counselling_scope,rank_raw,air,rank_type,allotted_quota,college_raw,course,seat_category,candidate_category,status,source_id
2022,STRAY,MCC,AIQ,5382,5382,AIR,Open Seat Quota,"JIPMER PUDUCHERRY,Dhanvantari Nagar Gorimedu Puducherry, Puducherry, 605006",MBBS,OBC,OBC,Allotted,8
2022,STRAY,MCC,AIQ,8713,8713,AIR,Open Seat Quota,"AIIMS, Rai Bareli ,All India Institute of Medical Sciences Raebareli, Uttar Pradesh, 229405",MBBS,Open,GN,Allotted,8
2022,STRAY,MCC,AIQ,11782,11782,AIR,Open Seat Quota,"AIIMS Guahawti,PO-CHANGSARI, DISTRICT-KAMRUP, Assam, 781101",MBBS,Open,GN,Allotted,8
2022,STRAY,MCC,AIQ,12397,12397,AIR,All India,"MADRAS MEDICAL COLLEGE, CHENNAI,MADRAS MEDICAL COLLEGE EVR PERIYAR SALAI,PARK TOWN,CHENNAI,TAMIL NADU., Tamil Nadu, 600003",MBBS,Open,GN,Allotted,8
2022,STRAY,MCC,AIQ,14836,14836,AIR,Open Seat Quota,"AIIMS, Madurai,AIIMS MADURAI, Tamil Nadu, 625008",MBBS,OBC,OBC,Allotted,8
2022,STRAY,MCC,AIQ,16344,16344,AIR,All India,"SARDAR PATEL MEDICAL COLLEGE, BIKANER,MEDICAL COLLEGE ROAD, BIKANER, Rajasthan, 334003",MBBS,Open,GN,Allotted,8
2022,STRAY,MCC,AIQ,16346,16346,AIR,Open Seat Quota,"AIIMS, Bibi Nagar, Hyderabad,AIIMS Bibinagar (Hyderabad Metropolitan Region) Telangana 508126, Telangana, 508126",MBBS,OBC,OBC,Allotted,8
2022,STRAY,MCC,AIQ,17330,17330,AIR,All India,"DR.S.N. MEDICAL COLLEGE, JODHPUR,RESIDENCY ROAD SHASTRI NAGAR JODHPUR RAJASTHAN 342 003, Rajasthan, 342003",MBBS,OBC,OBC,Allotted,8
2022,STRAY,MCC,AIQ,17487,17487,AIR,All India,"GOVT.MEDICAL COLLEGE, AMRITSAR,CIRCULAR ROAD, AMRITSAR-143001, Punjab, 143001",MBBS,Open,GN,Allotted,8
2022,STRAY,MCC,AIQ,17943,17943,AIR,All India,"LOKMANYA TILAK MUNICIPAL M C,MUMBAI,Dr. Babasaheb Ambedkar Road, Sion, Mumbai, Maharashtra, 400022",MBBS,OBC,OBC,Allotted,8
2022,STRAY,MCC,AIQ,17948,17948,AIR,All India,"GURU GOVIND SINGH MED COLL,FARIDKOT,Sadiq Road, Faridkot., Punjab, 151203",MBBS,Open,GN,Allotted,8
2022,STRAY,MCC,AIQ,18166,18166,AIR,All India,"R.N.T. MEDICAL COLLEGE, UDAIPUR,Opposite Court Chourha, Udaipur",MBBS,Open,OBC,Allotted,8
2022,STRAY,MCC,AIQ,18375,18375,AIR,All India,"M.G.M. MEDICAL COLLEGE, INDORE,AB ROAD INDORE",MBBS,Open,GN,Allotted,8
2022,STRAY,MCC,AIQ,19193,19193,AIR,All India,"Autonomous State Medical College ,Etah,NAGLA PADIHAR SIRAO MAHARARA LINK, PAC ROAD, SAKEET, ETAH,U.P.- 207001, Uttar Pradesh, 207001",MBBS,Open,GN,Allotted,8
2022,STRAY,MCC,AIQ,19220,19220,AIR,All India,"Uttar Pradesh University of Medical Sciences, Saifai, Etawah,SAIFAI ETAWAH, Uttar Pradesh, 206130",MBBS,OBC,OBC,Allotted,8
2022,STRAY,MCC,AIQ,19456,19456,AIR,All India,"DR.RAJENDRA PRASAD MC, TANDA,Dr.Rajendra Prasad Govt.Medical College Kangra at Tanda, H.P., Himachal Pradesh, 176002",MBBS,OBC,OBC,Allotted,8
2022,STRAY,MCC,AIQ,19603,19603,AIR,All India,"Bangalore Medical College and Research Institute,K R ROAD FORT BENGALURU, Karnataka, 560002",MBBS,EWS,EWS,Allotted,8
2022,STRAY,MCC,AIQ,19704,19704,AIR,All India,"GOVT. MEDICAL COLLEGE, NAGPUR,Hanuman Nagar,Nagpur",MBBS,Open,GN,Allotted,8
2022,STRAY,MCC,AIQ,20010,20010,AIR,All India,"Shri Atal Bihari Vajpayee Medical College & Research Institute, Bengaluru,SHIVAJINAGAR, BENGALURU, Karnataka, 560001",MBBS,EWS,EWS,Allotted,8
2022,STRAY,MCC,AIQ,20412,20412,AIR,All India,"Sagar Dutta Medical College & Hospital, Kolkata,578, B.T. Road, Kamarhati, Kolkata, West Bengal, 700058",MBBS,Open,GN,Allotted,8
2022,STRAY,MCC,AIQ,20827,20827,AIR,All India,"SLBS Govt. Medical College, Mandi,Mandi at Nerchowk Tehsil Balh PO Bhangrotu, Himachal Pradesh, 175021",MBBS,Open,EWS,Allotted,8
2022,STRAY,MCC,AIQ,21073,21073,AIR,All India,"ATAL BIHARI VAJPAYEE GOVERNMENT MEDICAL COLLEGE, VIDISHA,NH 86 INFRONT OF KHEL PARISAR SANCHI ROAD VIDISHA, Madhya Pradesh, 464001",MBBS,Open,GN,Allotted,8
2022,STRAY,MCC,AIQ,21219,21219,AIR,All India,"Autonomous State Medical College, Pratapgarh,Pure Keshav Rai Gay Ghat Road Pratapgarh, Uttar Pradesh, 230001",MBBS,Open,OBC,Allotted,8
2022,STRAY,MCC,AIQ,21304,21304,AIR,All India,"Prafulla Chandra Sen Government Medical College & Hospital, Arambagh,Arambagh, Hooghly, West Bengal, 712601",MBBS,Open,GN,Allotted,8
2022,STRAY,MCC,AIQ,21504,21504,AIR,All India,"SHRI ATAL BIHARI VAJPAYEE GOVERNMENT MEDICAL COLLEGE, CHHAINSA, FARIDABAD,Shri Atal Bihari Vajpayee Government Medical College Chhainsa Faridabad, Haryana, 121004",MBBS,Open,GN,Allotted,8
2022,STRAY,MCC,AIQ,21520,21520,AIR,All India,"GANDHI MEDICAL COLLEGE, BHOPAL,Royal Market Sultania Road Bhopal, Madhya Pradesh, 462001",MBBS,OBC,OBC,Allotted,8
2022,STRAY,MCC,AIQ,21733,21733,AIR,All India,"Govt. Medical College, Sirohi (rajasthan),SIROHI SHIVGANJ HIGHWAY,NEAR AMBESHWAR ,VILLAGE- KOLAR, TEHSIL- SIVGANJ,DIST- SIROHI, Rajasthan, 307030",MBBS,Open,GN,Allotted,8
2022,STRAY,MCC,AIQ,21811,21811,AIR,All India,"STANLEY MEDICAL COLLEGE, CHENNAI,No.1, Old Jail Road Chennai, Tamil Nadu, 600001",MBBS,Open,GN,Allotted,8
2022,STRAY,MCC,AIQ,21839,21839,AIR,All India,"Kalpana Chawla Govt. Medical College, Karnal,Kalpana Chawla Govt. Medical College,Karnal, Haryana, Haryana, 132001",MBBS,Open,GN,Allotted,8
2022,STRAY,MCC,AIQ,21842,21842,AIR,All India,"Veer Chandra Singh Garhwali Govt. Institute of Medical Science & Research,BADRINATH MARG, SRIKOT, SRINAGAR - PAURI GARHWAL, Uttarakhand, 246178",MBBS,Open,GN,Allotted,8
2022,STRAY,MCC,AIQ,21886,21886,AIR,All India,"MOTI LAL NEHRU MEDICAL COLL, ALLAHABAD,Principal Office Moti Lal Nehru Medical College, Lowther Road George Town Prayagraj, Uttar Pradesh, 211001",MBBS,EWS,EWS,Allotted,8
2022,STRAY,MCC,AIQ,22100,22100,AIR,All India,"CALCUTTA NATIONAL MED COLL,KOLKATA,32, GORACHAND ROAD, PARK CIRCUS, KOLKATA - 700014, West Bengal, 700014",MBBS,OBC,OBC,Allotted,8
2022,STRAY,MCC,AIQ,22147,22147,AIR,All India,"Uttar Pradesh University of Medical Sciences, Saifai, Etawah,SAIFAI ETAWAH, Uttar Pradesh, 206130",MBBS,OBC,OBC,Allotted,8
2022,STRAY,MCC,AIQ,22195,22195,AIR,Open Seat Quota,"JIPMER KARAIKAL,Dhanvantari Nagar Gorimedu Puducherry 605006, Puducherry, 605006",MBBS,OBC,OBC,Allotted,8
2022,STRAY,MCC,AIQ,22287,22287,AIR,All India,"Chandulal Chandrakar Memorial Government Medical College, Durg,Chandulal Chandrakar Memorial Government Medical College, Kurud Road, Near Rungta College, Kachandur, Chhattisgarh, 490024",MBBS,Open,GN,Allotted,8
2022,STRAY,MCC,AIQ,22295,22295,AIR,All India,"Government Medical College, Dholpur,411, OLD BARI ROAD, DHOLPUR, Rajasthan, 328001",MBBS,Open,GN,Allotted,8
2022,STRAY,MCC,AIQ,22347,22347,AIR,All India,"AGARTALA GOVT. MEDICAL COLLEGE,AGARTALA,Kunjaban, Agartala, Tripura West, Tripura, 799006",MBBS,Open,OBC,Allotted,8
2022,STRAY,MCC,AIQ,22352,22352,AIR,All India,"ESI-MC&PGIMS&R, Banglore,ESICMC AND PGIMSR, Rajajinagar, Bengaluru, Karnataka, 560010",MBBS,Open,OBC,Allotted,8
2022,STRAY,MCC,AIQ,22353,22353,AIR,All India,"STANLEY MEDICAL COLLEGE, CHENNAI,No.1, Old Jail Road Chennai, Tamil Nadu, 600001",MBBS,Open,GN,Allotted,8
2022,STRAY,MCC,AIQ,22359,22359,AIR,All India,"Govt. Medical College and Hospital, Chandrapur,GOVT. MEDICAL COLLEGE CHANDRAPUR, RAM NAGAR, CHANDRAPUR, Maharashtra, 442401",MBBS,Open,OBC,Allotted,8
2022,STRAY,MCC,AIQ,22362,22362,AIR,All India,"Govt Medical College Faizabad ,GANJA, PARGANA- HAVELI AWADH, TAHSIL- SADAR AYODHYA (FAIZABAD), Uttar Pradesh, 224001",MBBS,Open,GN,Allotted,8
2022,STRAY,MCC,AIQ,22366,22366,AIR,All India,"SUH Maulana Mahmood Hasan Medical College, Saharanpur,Ambala Road, Pilakhni, Saharanpur, Uttar Pradesh, 247001",MBBS,Open,OBC,Allotted,8
2022,STRAY,MCC,AIQ,22370,22370,AIR,All India,"GMC, Shahjhanpur,AUTONOMOUS STATE MEDICAL COLLEGE ALLIED PANDIT RAM PRASAD BISMIL HOSPITAL SHAHJAHANPUR UTTAR PRADESH, Uttar Pradesh, 242001",MBBS,Open,OBC,Allotted,8
2022,STRAY,MCC,AIQ,22376,22376,AIR,All India,"Dr. B.R. Ambedkar State Institute of Medical Sciences ,Sector 56 Mohali, Punjab, 160055",MBBS,OBC,OBC,Allotted,8
2022,STRAY,MCC,AIQ,22383,22383,AIR,All India,"STANLEY MEDICAL COLLEGE, CHENNAI,No.1, Old Jail Road Chennai, Tamil Nadu, 600001",MBBS,OBC,OBC,Allotted,8
2022,STRAY,MCC,AIQ,22400,22400,AIR,All India,"STANLEY MEDICAL COLLEGE, CHENNAI,No.1, Old Jail Road Chennai, Tamil Nadu, 600001",MBBS,OBC,OBC,Allotted,8
2022,STRAY,MCC,AIQ,22409,22409,AIR,All India,"STANLEY MEDICAL COLLEGE, CHENNAI,No.1, Old Jail Road Chennai, Tamil Nadu, 600001",MBBS,OBC,OBC,Allotted,8
2022,STRAY,MCC,AIQ,22415,22415,AIR,All India,"MYSORE MED.& RESEARCH INST. MYSORE,Mysore Medical College and Research Institute,Irwin Road, Mysore, Karnataka, 570021",MBBS,Open,GN,Allotted,8
2022,STRAY,MCC,AIQ,22416,22416,AIR,All India,"GOVT. MEDICAL COLLEGE,AURANGABAD,Government Medical College, Aurangabad, Jubli Park, Panchakki Road, Aurangabad (M.S.).",MBBS,OBC,OBC,Allotted,8
2022,STRAY,MCC,AIQ,22419,22419,AIR,All India,"Govt. Medical College, Srinagar,Administrative Department Government Medical College Karan Nagar Srinagar, Jammu And Kashmir, 190010",MBBS,OBC,OBC,Allotted,8
2022,STRAY,MCC,AIQ,22424,22424,AIR,All India,"SKIMS Medical College, Bemina, Srinagar,SKIMS MC BEMINA , SRINAGAR, JAMMU KASHMIR, Jammu And Kashmir, 190018",MBBS,Open,GN,Allotted,8
2022,STRAY,MCC,AIQ,22426,22426,AIR,All India,"GOVT. VELLORE MEDICAL COLLEGE, VELLORE,Government Vellore Medical College and Hospital, Adukkamparai, Vellore., Tamil Nadu, 632011",MBBS,Open,GN,Allotted,8
2022,STRAY,MCC,AIQ,22429,22429,AIR,All India,"Rajarshee Chhatrapati Shahu Maharaj Government Medical College Kolhapur,Rajarshee Chhatrapati Shahu Maharaj Government Medical College, R. K. Nagar Road, Shenda Park, Kol, Maharashtra, 416012",MBBS,Open,OBC,Allotted,8
2022,STRAY,MCC,AIQ,22438,22438,AIR,All India,"Government Medical College, Anantnag,verinag Road Dialgam Anantnag 192210, Jammu And Kashmir, 192210",MBBS,Open,OBC,Allotted,8
2022,STRAY,MCC,AIQ,22440,22440,AIR,All India,"Gmc, Bahraich,K.D.C Road Bahraich-271801, Uttar Pradesh, 271801",MBBS,OBC,OBC,Allotted,8
2022,STRAY,MCC,AIQ,22446,22446,AIR,All India,"Chhindwara Institute of Medical Sciences,Teachers Colony, Chhindwara, Madhya Pradesh 480001, Madhya Pradesh, 480001",MBBS,OBC,OBC,Allotted,8
2022,STRAY,MCC,AIQ,22447,22447,AIR,All India,"CHIKKABALLAPURA INSTITUTE OF MEDICAL SCIENCES, KARNATAKA,DISTRICT HOSPITAL CAMPUS MARULA SIDDESHWARA SWAMY TEMPLE ROAD CHIKKABALLAPUR KARANATAKA, Karnataka, 562101",MBBS,Open,OBC,Allotted,8
2022,STRAY,MCC,AIQ,22449,22449,AIR,All India,"DR.S.C.GOVT MEDICAL COLLEGE,,NANDED,VISHNUPURI NANDED MAHARASHTRA 431606, Maharashtra, 431606",MBBS,Open,OBC,Allotted,8
2022,STRAY,MCC,AIQ,22453,22453,AIR,All India,"VIJAYNAGAR INST OF MED. SC,BELLARY,Cantonment, Ballari, Karnataka, 583104",MBBS,Open,OBC,Allotted,8
2022,STRAY,MCC,AIQ,22460,22460,AIR,All India,"BURDWAN MEDICAL COLLEGE,BURDWAN,BURDWAN MEDICAL COLLEGE, BABURBAG, POST- RAJBATI, DIST- PURBA BARDHAMAN, PIN-713104,WEST BENGAL, West Bengal, 713104",MBBS,OBC,OBC,Allotted,8
2022,STRAY,MCC,AIQ,22478,22478,AIR,All India,"Govt Medical College Shahdol,GRAM CHAMPA KUDRI ROAD NEAR NEW BUS STAND SHAHDOL MP",MBBS,Open,OBC,Allotted,8
2022,STRAY,MCC,AIQ,22479,22479,AIR,All India,"GUNTUR MEDICAL COLLEGE, GUNTUR,Kannavarithoa Opp. NGOs Association Building, Andhra Pradesh, 522004",MBBS,Open,OBC,Allotted,8
2022,STRAY,MCC,AIQ,22480,22480,AIR,All India,"Kalpana Chawla Govt. Medical College, Karnal,Kalpana Chawla Govt. Medical College,Karnal, Haryana, Haryana, 132001",MBBS,OBC,OBC,Allotted,8
2022,STRAY,MCC,AIQ,22483,22483,AIR,All India,"Lt. L A M Govt. Medical College, Raigarh,T.V.Tower road, Bendrachua, Raigarh, Chhattisgarh, 496001",MBBS,Open,OBC,Allotted,8
2022,STRAY,MCC,AIQ,22486,22486,AIR,All India,"Gulbarga Institute of Medical Sciences, Gulbarga,Gulbarga Institute of Medical Sciences, Veeresh Nagar, Sedam Road, Kalaburagi, Karnataka, 585105",MBBS,Open,GN,Allotted,8
2022,STRAY,MCC,AIQ,22490,22490,AIR,All India,"Bhima Bhoi Medical College and Hospital , Balangir,PO - Rajendra College, District- Balangir, Odisha., Odisha, 767002",MBBS,OBC,OBC,Allotted,8
2022,STRAY,MCC,AIQ,22494,22494,AIR,All India,"Government Medical College, Anantnag,verinag Road Dialgam Anantnag 192210, Jammu And Kashmir, 192210",MBBS,OBC,OBC,Allotted,8
2022,STRAY,MCC,AIQ,22497,22497,AIR,All India,"Kalpana Chawla Govt. Medical College, Karnal,Kalpana Chawla Govt. Medical College,Karnal, Haryana, Haryana, 132001",MBBS,OBC,OBC,Allotted,8
2022,STRAY,MCC,AIQ,22499,22499,AIR,All India,"Goverment Medical College And Hospital Jalgaon,GOVERNMENT MEDICAL COLLEGE, JILHA PETH, NEAR MAIN POST OFFICE, JALGAON, Maharashtra, 425001",MBBS,OBC,OBC,Allotted,8
2022,STRAY,MCC,AIQ,22500,22500,AIR,All India,"M.G.M. MEDICAL COLLEGE,JAMSHEDPUR,Dimna Road, Mango, Jamshedpur, Jharkhand, 831020",MBBS,OBC,OBC,Allotted,8
2022,STRAY,MCC,AIQ,22508,22508,AIR,All India,"GOVERMENT MEDICAL COLLEGE NANDURBAR MAHARARASTRA,DISTRICT CIVIL HOSPITAL CAMPUS SAKRI ROAD NANDURBAR, Maharashtra, 425412",MBBS,Open,OBC,Allotted,8
2022,STRAY,MCC,AIQ,22516,22516,AIR,All India,"MAHARAJA K.C. GAJAPATI M.C.,BRAHMAPUR,MKCG MEDICAL COLLEGE CAMPUS, BERHAMPUR, GANJAM, Odisha, 760004",MBBS,Open,GN,Allotted,8
2022,STRAY,MCC,AIQ,22521,22521,AIR,All India,"MALDA MED. COLLEGE, MALDA,MaldaMedicalCollege, PS,EnglishBazar PO Dist Malda",MBBS,OBC,OBC,Allotted,8
2022,STRAY,MCC,AIQ,22522,22522,AIR,All India,"SHEIKH BHIKHARI MEDICAL COLLEGE & HOSPITAL, HAZARIBAG ( Formerly called as- Hazaribagh Medical College, Hazaribag),NEAR CENTRAL JAIL, HAZARIBAG, Jharkhand, 825301",MBBS,Open,OBC,Allotted,8
2022,STRAY,MCC,AIQ,22523,22523,AIR,All India,"SHEIKH BHIKHARI MEDICAL COLLEGE & HOSPITAL, HAZARIBAG ( Formerly called as- Hazaribagh Medical College, Hazaribag),NEAR CENTRAL JAIL, HAZARIBAG, Jharkhand, 825301",MBBS,OBC,OBC,Allotted,8
2022,STRAY,MCC,AIQ,22524,22524,AIR,All India,"MANDYA INST. OF MEDICAL SCI., MANDYA,BANGALORE-MYSORE MAIN ROAD, MANDYA, Karnataka, 571401",MBBS,Open,OBC,Allotted,8
2022,STRAY,MCC,AIQ,22527,22527,AIR,All India,"Lt. L A M Govt. Medical College, Raigarh,T.V.Tower road, Bendrachua, Raigarh, Chhattisgarh, 496001",MBBS,Open,OBC,Allotted,8
2022,STRAY,MCC,AIQ,22529,22529,AIR,All India,"Koppal Institute of Medical Sciences,DIRECTOR, KIMS,KOPPAL. GAGNAVATI ROAD, KIDDIDAL GATE,KOPPAL-583231, Karnataka, 583231",MBBS,Open,GN,Allotted,8
2022,STRAY,MCC,AIQ,22539,22539,AIR,All India,"Government Medical College, Rajnandgaon,Bharat Ratna Late Shri Atal Bihari Vajpayee Memorial Medical College, Pendri, Rajnandgaon. Chhattisg, Chhattisgarh, 491441",MBBS,Open,OBC,Allotted,8
2022,STRAY,MCC,AIQ,22543,22543,AIR,All India,"GOVT. VELLORE MEDICAL COLLEGE, VELLORE,Government Vellore Medical College and Hospital, Adukkamparai, Vellore., Tamil Nadu, 632011",MBBS,Open,GN,Allotted,8
2022,STRAY,MCC,AIQ,22544,22544,AIR,All India,"GOVERMENT MEDICAL COLLEGE NANDURBAR MAHARARASTRA,DISTRICT CIVIL HOSPITAL CAMPUS SAKRI ROAD NANDURBAR, Maharashtra, 425412",MBBS,Open,GN,Allotted,8
2022,STRAY,MCC,AIQ,22549,22549,AIR,All India,"Government Medical College, Kanker, Chhattisgarh,GOVERNMENT MEDICAL COLLEGE NANDANMARA KANKER, Chhattisgarh, 494334",MBBS,OBC,OBC,Allotted,8
2022,STRAY,MCC,AIQ,22554,22554,AIR,All India,"Medinirai Medical College (previously Known as Palamu Medical College), Palamu,Pokhraha Khurd, P.O- Rajwadih, P.S- Medininagar, Dist. Palamu, Jharkhand, 822118",MBBS,Open,OBC,Allotted,8
2022,STRAY,MCC,AIQ,22556,22556,AIR,All India,"GMERS Medical College, Rajpipla,GMERS Medical College, Rajpipla Near Jakat Naka, Vadia Palace, Rajpipla Dist Narmada, GUJARAT., Gujarat, 393145",MBBS,Open,GN,Allotted,8
2022,STRAY,MCC,AIQ,22559,22559,AIR,All India,"Lt. B R K Government Medical College, Jagdalpur,LATE BALIRAM KASHYAP MEMORIAL GOVT. MEDICAL COLLEGE, DIMRAPAL GEEDAM ROAD , JAGDALPUR DIST-BASTAR, Chhattisgarh, 494001",MBBS,Open,GN,Allotted,8
2022,STRAY,MCC,AIQ,22560,22560,AIR,All India,"SHKM GMC, Nalhar, Mewat, Haryana,THE DIRECTOR, SHAHEED HASAN KHAN,MEWATI GOVT. MEDICAL COLLEGE, NALHAR, NUH - HARYANA - 122107, Haryana, 122107",MBBS,Open,OBC,Allotted,8
2022,STRAY,MCC,AIQ,22575,22575,AIR,All India,"Sri Venkateswara Medical College, Tirupati,NEAR VIVEKANDANDA CIRCLE, ALIPIRI ROAD TIRUPATI, Andhra Pradesh, 517507",MBBS,OBC,OBC,Allotted,8
2022,STRAY,MCC,AIQ,22578,22578,AIR,All India,"Government Medical College, Korba(C.G.),Govt. Medical College, Village Jhagrha, Balco-urga Road, City Korba C.G., Chhattisgarh, 495683",MBBS,OBC,OBC,Allotted,8
2022,STRAY,MCC,AIQ,22580,22580,AIR,All India,"COIMBATORE MEDICAL COLLEGE,COIMBATORE,CIVIL AERODROME POST, AVINASHI ROAD, PEELAMEDU, COIMBATORE, Tamil Nadu, 641014",MBBS,OBC,OBC,Allotted,8
2022,STRAY,MCC,AIQ,22582,22582,AIR,All India,"Tomo Riba Institute Health and Medical Sciences, Naharlagun ,Tomo Riba Institute Health and Medical Sciences Old Assembly Complex Naharlagun, Arunachal Pradesh, 791110",MBBS,OBC,OBC,Allotted,8
2022,STRAY,MCC,AIQ,22583,22583,AIR,All India,"SHKM GMC, Nalhar, Mewat, Haryana,THE DIRECTOR, SHAHEED HASAN KHAN,MEWATI GOVT. MEDICAL COLLEGE, NALHAR, NUH - HARYANA - 122107, Haryana, 122107",MBBS,Open,GN,Allotted,8
2022,STRAY,MCC,AIQ,22585,22585,AIR,All India,"SHKM GMC, Nalhar, Mewat, Haryana,THE DIRECTOR, SHAHEED HASAN KHAN,MEWATI GOVT. MEDICAL COLLEGE, NALHAR, NUH - HARYANA - 122107, Haryana, 122107",MBBS,OBC,OBC,Allotted,8
2022,STRAY,MCC,AIQ,22590,22590,AIR,All India,"Govt Medical College, Palakkad,NH-544, EAST YAKKARA, KUNNATHURMEDU POST, PALAKKAD-678013, Kerala, 678013",MBBS,Open,GN,Allotted,8
2022,STRAY,MCC,AIQ,22594,22594,AIR,All India,"Haveri Institute of Medical Sciences, Karnataka,First Floor MCH Block District Hospital, Karnataka, 581110",MBBS,OBC,OBC,Allotted,8
2022,STRAY,MCC,AIQ,22596,22596,AIR,All India,"ZORAM MEDICAL COLLEGE Falkawn,Falkawn, Aizawl District, Mizoram, 796005",MBBS,Open,GN,Allotted,8
2022,STRAY,MCC,AIQ,22599,22599,AIR,All India,"GOVT. KILPAUK MEDICAL COLLEGE,CHENNAI,No. 822, EVR Periyar salai , Kilpauk,Chennai, Tamil Nadu, 600010",MBBS,OBC,OBC,Allotted,8
2022,STRAY,MCC,AIQ,22601,22601,AIR,All India,"YADGIRI INSTITUTE OF MEDICAL SCIENCES, YADGIRI,Chittapur Main Road, Yadgiri., Karnataka, 585202",MBBS,Open,GN,Allotted,8
2022,STRAY,MCC,AIQ,22604,22604,AIR,All India,"THANJAVUR MEDICAL COLL.,THANJAVUR,Thanjavur Medical College,Thanjavur, Tamil Nadu, 613004",MBBS,Open,GN,Allotted,8
2022,STRAY,MCC,AIQ,22611,22611,AIR,All India,"Government Medical College, Bhadradri, Kothagudem,besides Sammakka Saarakka temple, Opp KSM Petrol bunk, end of 6th Battalion Rd, Palwancha, Telangana, Telangana, 507115",MBBS,Open,GN,Allotted,8
2022,STRAY,MCC,AIQ,22614,22614,AIR,All India,"IRT Perundurai Medical College, Perundurai,GOVERNMENT ERODE MEDICAL COLLEGE PERUNDURAI, PERUNDURAI SANATORIUM POST ERODE DISTRICT, Tamil Nadu, 638053",MBBS,Open,GN,Allotted,8
2022,STRAY,MCC,AIQ,22621,22621,AIR,All India,"GOVT. VELLORE MEDICAL COLLEGE, VELLORE,Government Vellore Medical College and Hospital, Adukkamparai, Vellore., Tamil Nadu, 632011",MBBS,Open,GN,Allotted,8
2022,STRAY,MCC,AIQ,22623,22623,AIR,All India,"GTMC, THIRUVARUR,MASTER PLAN COMPLEX, VILAMAL VILLAGE, THIRUVARUR, Tamil Nadu, 610004",MBBS,Open,GN,Allotted,8
2022,STRAY,MCC,AIQ,22627,22627,AIR,All India,"Lakhimpur Medical College, North Lakhimpur, Assam,Chowkham Saboti North Lakhimpur Lakhimpur, Assam, 787051",MBBS,Open,GN,Allotted,8
2022,STRAY,MCC,AIQ,22629,22629,AIR,All India,"COIMBATORE MEDICAL COLLEGE,COIMBATORE,CIVIL AERODROME POST, AVINASHI ROAD, PEELAMEDU, COIMBATORE, Tamil Nadu, 641014",MBBS,OBC,OBC,Allotted,8
2022,STRAY,MCC,AIQ,22631,22631,AIR,All India,"THENI GOVT. MEDICAL COLLEGE, THENI,G. Vilakku, Shanmugasundarapuram village, Aundipatti Taluk, Theni District, Tamil Nadu, 625512",MBBS,Open,GN,Allotted,8
2022,STRAY,MCC,AIQ,22632,22632,AIR,All India,"MADURAI MEDICAL COLLEGE, MADURAI,PANAGAL ROAD MADURAI, Tamil Nadu, 625020",MBBS,OBC,OBC,Allotted,8
2022,STRAY,MCC,AIQ,22633,22633,AIR,All India,"Andaman and Nicobar Islands Institute of Medical S,Director ANIIMS, DHS Annexe Building, Atlanta Point, Port Blair-744104, Andaman And Nicobar Islands, 744104",MBBS,Open,OBC,Allotted,8
2022,STRAY,MCC,AIQ,22636,22636,AIR,All India,"GOVT. MOHAN KUMARAMANGALAM M.C.,SALEM,MAJEERA KOLLAPPATTI, Salem steel Plant Road Salem 636030 TamilNadu, Tamil Nadu, 636030",MBBS,OBC,OBC,Allotted,8
2022,STRAY,MCC,AIQ,22637,22637,AIR,All India,"Andaman and Nicobar Islands Institute of Medical S,Director ANIIMS, DHS Annexe Building, Atlanta Point, Port Blair-744104, Andaman And Nicobar Islands, 744104",MBBS,Open,OBC,Allotted,8
2022,STRAY,MCC,AIQ,22639,22639,AIR,All India,"Government Medical College, Churachandpur,Hiangtam Lamka, I.B. Road, Churachandpur District, Manipur, 795128",MBBS,Open,GN,Allotted,8
2022,STRAY,MCC,AIQ,22645,22645,AIR,All India,"GTMC, THIRUVARUR,MASTER PLAN COMPLEX, VILAMAL VILLAGE, THIRUVARUR, Tamil Nadu, 610004",MBBS,Open,OBC,Allotted,8
2022,STRAY,MCC,AIQ,22646,22646,AIR,All India,"SHRI ATAL BIHARI VAJPAYEE GOVERNMENT MEDICAL COLLEGE, CHHAINSA, FARIDABAD,Shri Atal Bihari Vajpayee Government Medical College Chhainsa Faridabad, Haryana, 121004",MBBS,OBC,OBC,Allotted,8
2022,STRAY,MCC,AIQ,22648,22648,AIR,All India,"Andaman and Nicobar Islands Institute of Medical S,Director ANIIMS, DHS Annexe Building, Atlanta Point, Port Blair-744104, Andaman And Nicobar Islands, 744104",MBBS,OBC,OBC,Allotted,8
2022,STRAY,MCC,AIQ,22650,22650,AIR,All India,"Govt. Sivgangai M. C. Sivagangai,MANAMADURAI MAIN ROAD, KEELA VANIYANKUDI, SIVAGANGAI, Tamil Nadu, 630561",MBBS,OBC,OBC,Allotted,8
2022,STRAY,MCC,AIQ,22654,22654,AIR,All India,"BPS Govt. Med. College, Sonepat,BPS GOVT MEDICAL COLLEGE FOR WOMEN KHANPUR KALAN SONEPAT, Haryana, 131305 (Female Seat only )",MBBS,OBC,OBC,Allotted,8
2022,STRAY,MCC,AIQ,22657,22657,AIR,All India,"IRT Perundurai Medical College, Perundurai,GOVERNMENT ERODE MEDICAL COLLEGE PERUNDURAI, PERUNDURAI SANATORIUM POST ERODE DISTRICT, Tamil Nadu, 638053",MBBS,Open,OBC,Allotted,8
2022,STRAY,MCC,AIQ,22665,22665,AIR,All India,"GMERS Medical College, Navsari,Adarsh Nivasi Shala Campus, At & Po. - Khambhlav, Aat, Ta - Jalalpore, Dist - Navsari., Gujarat, 396403",MBBS,Open,GN,Allotted,8
2022,STRAY,MCC,AIQ,22666,22666,AIR,All India,"Government Medical College, Jagtial,Government Medical College, Jagtial, Jagtial Village, Jagtial Tehsil, Jagtial Dist, Telangana, 505327",MBBS,Open,OBC,Allotted,8
2022,STRAY,MCC,AIQ,22668,22668,AIR,All India,"Government Medical College, Ariyalur ,1 COLLEGE ROAD GOVERNMENT MEDICAL COLLEGE ARIYALUR TAMIL NADU PIN 621713, Tamil Nadu, 621713",MBBS,Open,OBC,Allotted,8
2022,STRAY,MCC,AIQ,22671,22671,AIR,All India,"GMERS Medical College, Morbi,Gibson middle school, Opp railway station, Morbi, Gujarat, 363641",MBBS,Open,GN,Allotted,8
2022,STRAY,MCC,AIQ,22675,22675,AIR,All India,"Government Medical College, Nagapattinam,NO.1,MANALMEDU, ORATHUR VILLAGE, NAGAPATTINAM TK, NAGAPATTINAM DISTRICT, Tamil Nadu, 611108",MBBS,Open,GN,Allotted,8
2022,STRAY,MCC,AIQ,22677,22677,AIR,All India,"GMERS Medical College, Rajpipla,GMERS Medical College, Rajpipla Near Jakat Naka, Vadia Palace, Rajpipla Dist Narmada, GUJARAT., Gujarat, 393145",MBBS,Open,OBC,Allotted,8
2022,STRAY,MCC,AIQ,22681,22681,AIR,All India,"GMERS Medical College, Rajpipla,GMERS Medical College, Rajpipla Near Jakat Naka, Vadia Palace, Rajpipla Dist Narmada, GUJARAT., Gujarat, 393145",MBBS,Open,GN,Allotted,8
2022,STRAY,MCC,AIQ,22684,22684,AIR,All India,"GMERS Medical College, Morbi,Gibson middle school, Opp railway station, Morbi, Gujarat, 363641",MBBS,OBC,OBC,Allotted,8
2022,STRAY,MCC,AIQ,22685,22685,AIR,All India,"Government Medical College, Jagtial,Government Medical College, Jagtial, Jagtial Village, Jagtial Tehsil, Jagtial Dist, Telangana, 505327",MBBS,Open,GN,Allotted,8
2022,STRAY,MCC,AIQ,22688,22688,AIR,All India,"Haveri Institute of Medical Sciences, Karnataka,First Floor MCH Block District Hospital, Karnataka, 581110",MBBS,OBC,OBC,Allotted,8
2022,STRAY,MCC,AIQ,22689,22689,AIR,All India,"Government Medical College, Mancherial,Government Medical College 708 Garmilla Village , Mancherial Tehsil Mancherial., Telangana, 504208",MBBS,Open,OBC,Allotted,8
2022,STRAY,MCC,AIQ,22691,22691,AIR,All India,"THOOTHUKUDI MEDICAL COLLEGE,THOOTHUKUDI,KAMARAJ NAGAR, 3rd MILE, THOOTHUKUDI, Tamil Nadu, 628008",MBBS,OBC,OBC,Allotted,8
2022,STRAY,MCC,AIQ,22695,22695,AIR,All India,"Haveri Institute of Medical Sciences, Karnataka,First Floor MCH Block District Hospital, Karnataka, 581110",MBBS,OBC,OBC,Allotted,8
2022,STRAY,MCC,AIQ,22701,22701,AIR,All India,"SILCHAR MEDICAL COLLEGE, SILCHER,PO Silchar Medical College, Silchar, Assam, 788014",MBBS,OBC,OBC,Allotted,8
2022,STRAY,MCC,AIQ,22703,22703,AIR,All India,"Diphu Medical College & Hospital, Assam,principaldiphu1@gmail.com, Assam, 782462",MBBS,Open,GN,Allotted,8
2022,STRAY,MCC,AIQ,22706,22706,AIR,All India,"Diphu Medical College & Hospital, Assam,principaldiphu1@gmail.com, Assam, 782462",MBBS,Open,OBC,Allotted,8
2022,STRAY,MCC,AIQ,22707,22707,AIR,All India,"GMERS Medical College, Rajpipla,GMERS Medical College, Rajpipla Near Jakat Naka, Vadia Palace, Rajpipla Dist Narmada, GUJARAT., Gujarat, 393145",MBBS,OBC,OBC,Allotted,8
2022,STRAY,MCC,AIQ,22710,22710,AIR,All India,"Government Medical College, Nilgiris,No. 1, INDU NAGAR, MYSORE ROAD, UDHAGAMANDALAM, NILGIRIS DISTRICT, Tamil Nadu, 643005",MBBS,OBC,OBC,Allotted,8
2022,STRAY,MCC,AIQ,22711,22711,AIR,All India,"GOVT MEDICAL COLLEGE, WANAPARTHY ,Marrikunta, Pebbair Road, Wanaparthy District, Telangana state., Telangana, 509103",MBBS,OBC,OBC,Allotted,8
2022,STRAY,MCC,AIQ,22712,22712,AIR,All India,"GMERS Medical College, Rajpipla,GMERS Medical College, Rajpipla Near Jakat Naka, Vadia Palace, Rajpipla Dist Narmada, GUJARAT., Gujarat, 393145",MBBS,OBC,OBC,Allotted,8
2022,STRAY,MCC,AIQ,22719,22719,AIR,All India,"GOVT MEDICAL COLLEGE, WANAPARTHY ,Marrikunta, Pebbair Road, Wanaparthy District, Telangana state., Telangana, 509103",MBBS,OBC,OBC,Allotted,8
2022,STRAY,MCC,AIQ,22720,22720,AIR,All India,"Government Medical College, Nilgiris,No. 1, INDU NAGAR, MYSORE ROAD, UDHAGAMANDALAM, NILGIRIS DISTRICT, Tamil Nadu, 643005",MBBS,OBC,OBC,Allotted,8
2022,STRAY,MCC,AIQ,22721,22721,AIR,All India,"ZORAM MEDICAL COLLEGE Falkawn,Falkawn, Aizawl District, Mizoram, 796005",MBBS,OBC,OBC,Allotted,8
