year,max_marks,registered_candidates,appeared_candidates,qualified_candidates,highest_marks,toppers_at_highest,cutoff_ur,cutoff_obc,cutoff_sc,cutoff_st,cutoff_ews,result_date,source_id,notes
2020,720,1597435,1366945,771500,720,2,147,113,113,113,147,2020-10-16,35,"Exam Sep 13 2020; delayed due to COVID-19; toppers Soyeb Aftab and Akansha Singh"
2021,720,1614777,1544275,870075,720,3,138,108,108,108,138,2021-11-01,36,"Exam Sep 12 2021; delayed due to COVID-19"
2022,720,1872343,1764571,993069,715,1,117,93,93,93,117,2022-09-07,37,"Exam Jul 17 2022; highest marks 715 (not 720)"
2023,720,2087462,2038596,1145976,720,2,137,107,107,107,137,2023-06-13,38,"Exam May 7 2023; first post-COVID normal exam cycle"
2024,720,2406079,2333297,1316268,720,61,164,129,129,129,164,2024-07-26,39,"Exam May 5 2024; re-revised result after grace-marks controversy; 67→61 toppers after retest"
2025,720,2276069,2209318,1208226,686,1,144,113,113,113,144,2025-06-14,40,"Exam May 4 2025; registrations dipped first time; highest score 686 (not 720)"
